<!DOCTYPE twitch SYSTEM "twitch.dtd">
<twitch xmlns:stm="https://www.twitch.tv/streamer_username/"  xmlns:usr="https://www.twitch.tv/username/">
    <streams>
        <stream>
            <categories>
                <category id="2051613">
                    <category_name>Pokemon Fire Red</category_name>
                    <trending_rank>60</trending_rank>
                </category>
                <category id="2512343">
                    <category_name>Just Chatting</category_name>
                    <trending_rank>2</trending_rank>
                </category>
            </categories>
            <streamer>
                <stm:username>Arkevp</stm:username>
                <stm:viewers>7.2k</stm:viewers>
                <stm:language>Espa√±ol</stm:language>
                <stm:subscriptions>20</stm:subscriptions>
                <stm:tags>
                    <stm:tag>Art</stm:tag>
                </stm:tags>
                <stm:url>https://www.twitch.tv/Arkevp/</stm:url>
            </streamer>
            <viewers_users>
                <user>
                    <usr:username>Miova</usr:username>
                    <usr:last_message>Hello world!</usr:last_message>
                    <usr:language>Spanish</usr:language>
                    <usr:sub_chanels>
                        <usr:sub_chanel>Arkevp</usr:sub_chanel>
                    </usr:sub_chanels>
                </user>
                <user>
                    <usr:username>Erizomovil</usr:username>
                    <usr:last_message>Hell! Hell!</usr:last_message>
                    <usr:language>English</usr:language>
                    <usr:sub_chanels>
                        <usr:sub_chanel>Arkevp</usr:sub_chanel>
                    </usr:sub_chanels>
                </user>
            </viewers_users>
        </stream>
    </streams>
</twitch>
